[
  {
    "slug": "female-medium-medium-layer-straight-untreated",
    "nameKo": "여성 미디엄 레이어 · 직모 일반 모발",
    "description": "여성 중기장 미디엄 레이어를 직모, 보통 굵기 모발, 일반 모발 조건에 맞춰 제안하는 블루프린트.",
    "lengthBucket": "medium",
    "correctionFocus": "crown",
    "silhouette": "medium medium layer",
    "texture": "controlled straight texture",
    "bangType": "no fixed bangs",
    "volumeFocusTags": [
      "crown",
      "crown-balance"
    ],
    "faceShapeFitTags": [
      "oval",
      "round"
    ],
    "avoidTags": [
      "excessive-top-height"
    ],
    "promptTemplate": "Korean women's hairstyle direction, jaw-to-shoulder medium length, balanced medium layers, controlled straight texture with natural movement, balanced medium strand thickness with natural weight, healthy natural-looking finish, keep the existing natural hair color, realistic salon-achievable finish",
    "promptTemplateVersion": "catalog-v4",
    "styleTargets": [
      "female"
    ],
    "trendKeywords": [
      "미디엄 레이어",
      "여성 중기장 미디엄 레이어",
      "직모",
      "생머리",
      "보통 굵기 모발",
      "일반 모발",
      "건강모"
    ],
    "baselineTrendScore": 48,
    "baselineFreshnessScore": 46,
    "styleFamily": "medium-layer",
    "variantKey": "female-medium-straight-untreated",
    "primaryTexture": "straight",
    "compatibleTextureTags": [
      "straight"
    ],
    "avoidTextureTags": [],
    "primaryStrandThickness": "medium",
    "compatibleStrandThicknessTags": [
      "fine",
      "medium",
      "coarse"
    ],
    "avoidStrandThicknessTags": [],
    "primaryCondition": "untreated",
    "compatibleConditionTags": [
      "untreated",
      "colored"
    ],
    "avoidConditionTags": [],
    "requiredServices": [
      "cut",
      "low_heat_styling"
    ],
    "serviceConstraints": [
      "professional_assessment"
    ],
    "maintenanceLevel": "low",
    "introducedIn": "expansion-a"
  },
  {
    "slug": "female-medium-medium-hush-wavy-curly-untreated",
    "nameKo": "여성 미디엄 허쉬 · 곱슬 웨이브 일반 모발",
    "description": "여성 중기장 미디엄 허쉬를 곱슬 웨이브, 가는 모발, 일반 모발 조건에 맞춰 제안하는 블루프린트.",
    "lengthBucket": "medium",
    "correctionFocus": "temple",
    "silhouette": "medium medium hush",
    "texture": "defined soft wave texture",
    "bangType": "soft fringe",
    "volumeFocusTags": [
      "temple",
      "temple-balance"
    ],
    "faceShapeFitTags": [
      "oval",
      "long-face"
    ],
    "avoidTags": [
      "excessive-side-volume"
    ],
    "promptTemplate": "Korean women's hairstyle direction, jaw-to-shoulder medium length, medium hush layers, defined soft waves following the natural curl direction, fine strands with lightweight volume and no heavy product buildup, healthy natural-looking finish, keep the existing natural hair color, realistic salon-achievable finish",
    "promptTemplateVersion": "catalog-v4",
    "styleTargets": [
      "female"
    ],
    "trendKeywords": [
      "미디엄 허쉬",
      "여성 중기장 미디엄 허쉬",
      "곱슬",
      "반곱슬",
      "웨이브",
      "가는 모발",
      "일반 모발",
      "건강모"
    ],
    "baselineTrendScore": 49,
    "baselineFreshnessScore": 47,
    "styleFamily": "medium-hush",
    "variantKey": "female-medium-wavy_curly-untreated",
    "primaryTexture": "wavy_curly",
    "compatibleTextureTags": [
      "wavy_curly"
    ],
    "avoidTextureTags": [],
    "primaryStrandThickness": "fine",
    "compatibleStrandThicknessTags": [
      "fine",
      "medium"
    ],
    "avoidStrandThicknessTags": [
      "coarse"
    ],
    "primaryCondition": "untreated",
    "compatibleConditionTags": [
      "untreated",
      "colored"
    ],
    "avoidConditionTags": [
      "damaged",
      "bleached",
      "severely_damaged"
    ],
    "requiredServices": [
      "cut",
      "perm"
    ],
    "serviceConstraints": [
      "professional_assessment"
    ],
    "maintenanceLevel": "high",
    "introducedIn": "expansion-a"
  },
  {
    "slug": "female-medium-c-curl-tight-curly-frizzy-untreated",
    "nameKo": "여성 C컬 미디엄 · 강한 곱슬 일반 모발",
    "description": "여성 중기장 C컬 미디엄를 강한 곱슬, 굵은 모발, 일반 모발 조건에 맞춰 제안하는 블루프린트.",
    "lengthBucket": "medium",
    "correctionFocus": "jawline",
    "silhouette": "medium c curl",
    "texture": "controlled tight curl texture",
    "bangType": "curtain fringe",
    "volumeFocusTags": [
      "jawline",
      "lower-frame"
    ],
    "faceShapeFitTags": [
      "oval",
      "round"
    ],
    "avoidTags": [
      "heavy-lower-volume"
    ],
    "promptTemplate": "Korean women's hairstyle direction, jaw-to-shoulder medium length, inward C-curl contour, defined tight curls with controlled frizz and preserved curl identity, coarse strands with controlled weight and clearly separated movement, healthy natural-looking finish, keep the existing natural hair color, realistic salon-achievable finish",
    "promptTemplateVersion": "catalog-v4",
    "styleTargets": [
      "female"
    ],
    "trendKeywords": [
      "C컬 미디엄",
      "여성 중기장 C컬 미디엄",
      "강한 곱슬",
      "부스스한 머리",
      "악성곱슬",
      "굵은 모발",
      "일반 모발",
      "건강모"
    ],
    "baselineTrendScore": 50,
    "baselineFreshnessScore": 48,
    "styleFamily": "c-curl",
    "variantKey": "female-medium-tight_curly_frizzy-untreated",
    "primaryTexture": "tight_curly_frizzy",
    "compatibleTextureTags": [
      "tight_curly_frizzy"
    ],
    "avoidTextureTags": [],
    "primaryStrandThickness": "coarse",
    "compatibleStrandThicknessTags": [
      "medium",
      "coarse"
    ],
    "avoidStrandThicknessTags": [
      "fine"
    ],
    "primaryCondition": "untreated",
    "compatibleConditionTags": [
      "untreated",
      "colored"
    ],
    "avoidConditionTags": [],
    "requiredServices": [
      "cut",
      "curl_definition"
    ],
    "serviceConstraints": [
      "professional_assessment"
    ],
    "maintenanceLevel": "high",
    "introducedIn": "expansion-a"
  },
  {
    "slug": "female-medium-s-curl-lob-straight-damaged",
    "nameKo": "여성 S컬 로브 · 직모 손상 모발",
    "description": "여성 중기장 S컬 로브를 직모, 보통 굵기 모발, 손상 모발 조건에 맞춰 제안하는 블루프린트.",
    "lengthBucket": "medium",
    "correctionFocus": "crown",
    "silhouette": "medium s curl lob",
    "texture": "controlled straight texture",
    "bangType": "no fixed bangs",
    "volumeFocusTags": [
      "crown",
      "crown-balance"
    ],
    "faceShapeFitTags": [
      "oval",
      "long-face"
    ],
    "avoidTags": [
      "excessive-top-height"
    ],
    "promptTemplate": "Korean women's hairstyle direction, jaw-to-shoulder medium length, soft S-curl lob, controlled straight texture with natural movement, balanced medium strand thickness with natural weight, polished low-heat finish that does not exaggerate visible damage, keep the existing natural hair color, realistic salon-achievable finish",
    "promptTemplateVersion": "catalog-v4",
    "styleTargets": [
      "female"
    ],
    "trendKeywords": [
      "S컬 로브",
      "여성 중기장 S컬 로브",
      "직모",
      "생머리",
      "보통 굵기 모발",
      "손상모",
      "상한 머리"
    ],
    "baselineTrendScore": 51,
    "baselineFreshnessScore": 49,
    "styleFamily": "s-curl-lob",
    "variantKey": "female-medium-straight-damaged",
    "primaryTexture": "straight",
    "compatibleTextureTags": [
      "straight"
    ],
    "avoidTextureTags": [],
    "primaryStrandThickness": "medium",
    "compatibleStrandThicknessTags": [
      "fine",
      "medium",
      "coarse"
    ],
    "avoidStrandThicknessTags": [],
    "primaryCondition": "damaged",
    "compatibleConditionTags": [
      "damaged",
      "colored"
    ],
    "avoidConditionTags": [
      "severely_damaged"
    ],
    "requiredServices": [
      "cut",
      "low_heat_styling"
    ],
    "serviceConstraints": [
      "cut_first",
      "low_heat",
      "professional_assessment"
    ],
    "maintenanceLevel": "low",
    "introducedIn": "expansion-a"
  },
  {
    "slug": "female-medium-clavicle-bob-wavy-curly-damaged",
    "nameKo": "여성 쇄골 보브 · 곱슬 웨이브 손상 모발",
    "description": "여성 중기장 쇄골 보브를 곱슬 웨이브, 가는 모발, 손상 모발 조건에 맞춰 제안하는 블루프린트.",
    "lengthBucket": "medium",
    "correctionFocus": "temple",
    "silhouette": "medium clavicle bob",
    "texture": "defined soft wave texture",
    "bangType": "soft fringe",
    "volumeFocusTags": [
      "temple",
      "temple-balance"
    ],
    "faceShapeFitTags": [
      "oval",
      "round"
    ],
    "avoidTags": [
      "excessive-side-volume"
    ],
    "promptTemplate": "Korean women's hairstyle direction, jaw-to-shoulder medium length, clavicle-length bob, defined soft waves following the natural curl direction, fine strands with lightweight volume and no heavy product buildup, polished low-heat finish that does not exaggerate visible damage, keep the existing natural hair color, realistic salon-achievable finish",
    "promptTemplateVersion": "catalog-v4",
    "styleTargets": [
      "female"
    ],
    "trendKeywords": [
      "쇄골 보브",
      "여성 중기장 쇄골 보브",
      "곱슬",
      "반곱슬",
      "웨이브",
      "가는 모발",
      "손상모",
      "상한 머리"
    ],
    "baselineTrendScore": 52,
    "baselineFreshnessScore": 50,
    "styleFamily": "clavicle-bob",
    "variantKey": "female-medium-wavy_curly-damaged",
    "primaryTexture": "wavy_curly",
    "compatibleTextureTags": [
      "wavy_curly"
    ],
    "avoidTextureTags": [],
    "primaryStrandThickness": "fine",
    "compatibleStrandThicknessTags": [
      "fine",
      "medium"
    ],
    "avoidStrandThicknessTags": [
      "coarse"
    ],
    "primaryCondition": "damaged",
    "compatibleConditionTags": [
      "damaged",
      "colored"
    ],
    "avoidConditionTags": [
      "severely_damaged"
    ],
    "requiredServices": [
      "cut",
      "texture_styling"
    ],
    "serviceConstraints": [
      "cut_first",
      "low_heat",
      "professional_assessment"
    ],
    "maintenanceLevel": "medium",
    "introducedIn": "expansion-a"
  },
  {
    "slug": "female-medium-jelly-medium-tight-curly-frizzy-damaged",
    "nameKo": "여성 젤리 미디엄 · 강한 곱슬 손상 모발",